{
  "$schema": "./runtime-inventory.schema.json",
  "version": "1.0.0",
  "principle": "runtime-obligation-first",
  "sourceKinds": [
    "request"
  ],
  "sources": [
    {
      "id": "runtime-entry",
      "description": "Replace this with a real runtime source for your project.",
      "kind": "request",
      "sourcePatterns": [
        "src/**/*.ts"
      ],
      "events": [
        "Replace this with a real external runtime event."
      ],
      "expectedEvidence": [
        "response"
      ],
      "expectedOutcomeClasses": [
        "success",
        "failure"
      ],
      "surfaceHint": "runtime-entry",
      "minimumFidelity": "simulated"
    }
  ],
  "behaviors": [
    {
      "id": "runtime-entry.example-behavior",
      "sourceId": "runtime-entry",
      "event": "Replace this with a reviewed runtime behavior for your project.",
      "expectedEvidence": [
        "response"
      ],
      "expectedOutcomeClasses": [
        "success",
        "failure"
      ],
      "minimumFidelity": "simulated"
    }
  ]
}
